{
 "$schema": "../../../plugins/qa-os/schemas/screen.schema.json",
 "option_id": "DYL_202037",
 "title": "PJP Daily Inquiry",
 "menu": {
  "path": [
   "Distributor Setup",
   "Journey Plan",
   "PJP Daily Inquiry"
  ],
  "option_id": "DYL_202037",
  "search_text": "PJP Daily Inquiry",
  "top_id": "NG04",
  "app_option": null
 },
 "route": "/dyl/layout",
 "page_param": "layoutCode=202037",
 "layout_code": "202037",
 "kind": "dynamic",
 "tabs": [],
 "panels": [
  {
   "page": "202037001",
   "tab": null,
   "desc": null,
   "table": "snd_en_pjp_pjphead_daily",
   "is_child": false,
   "grids": [],
   "n_fields": 2
  },
  {
   "page": "202037002",
   "tab": null,
   "desc": null,
   "table": "(",
   "is_child": true,
   "grids": [
    "grid1"
   ],
   "n_fields": 0
  },
  {
   "page": "202037003",
   "tab": null,
   "desc": null,
   "table": "snd_en_pjp_pjphead_daily",
   "is_child": true,
   "grids": [
    "grid1"
   ],
   "n_fields": 0
  }
 ],
 "fields": {
  "Working Date": {
   "element": "DT_epjpworkingdateParent",
   "widget": "date",
   "required": false,
   "readonly": false,
   "data_field": "EPJP_WORKING_DATE",
   "config_id": "datebox1",
   "provenance": {
    "source": "observed",
    "env": "cnr2dev3",
    "date": "2026-09-25",
    "ref": "apps/snd/knowledge/screens_observed/DYL_202037.json"
   },
   "locator": {
    "id": "DT_epjpworkingdateParent"
   },
   "seen_in": [
    "db",
    "observed:cnr2dev3:2026-09-25"
   ]
  },
  "DSR Type": {
   "element": "TXT__epp2busentcodephslvl2fParent",
   "widget": "select",
   "required": false,
   "readonly": false,
   "data_field": "EPP2_BUSENT_CODE_PHS_LVL2_F",
   "list_source": "PDST",
   "config_id": "selectbox1",
   "provenance": {
    "source": "observed",
    "env": "cnr2dev3",
    "date": "2026-09-25",
    "ref": "apps/snd/knowledge/screens_observed/DYL_202037.json"
   },
   "locator": {
    "id": "TXT__epp2busentcodephslvl2fParent"
   },
   "seen_in": [
    "db",
    "observed:cnr2dev3:2026-09-25"
   ]
  }
 },
 "buttons": {
  "Process": {
   "element": null,
   "provenance": {
    "source": "db",
    "env": null,
    "date": null,
    "ref": "apps/snd/knowledge/screens_db/DYL_202037.json"
   },
   "seen_in": [
    "db"
   ]
  },
  "Refresh": {
   "element": null,
   "provenance": {
    "source": "db",
    "env": null,
    "date": null,
    "ref": "apps/snd/knowledge/screens_db/DYL_202037.json"
   },
   "seen_in": [
    "db"
   ]
  },
  "1": {
   "element": "pagination-element-1",
   "locator": {
    "id": "pagination-element-1"
   },
   "provenance": {
    "source": "observed",
    "env": "cnr2dev3",
    "date": "2026-09-25",
    "ref": "apps/snd/knowledge/screens_observed/DYL_202037.json"
   },
   "seen_in": [
    "observed:cnr2dev3:2026-09-25"
   ]
  },
  "2": {
   "element": "pagination-element-2",
   "locator": {
    "id": "pagination-element-2"
   },
   "provenance": {
    "source": "observed",
    "env": "cnr2dev3",
    "date": "2026-09-25",
    "ref": "apps/snd/knowledge/screens_observed/DYL_202037.json"
   },
   "seen_in": [
    "observed:cnr2dev3:2026-09-25"
   ]
  },
  "3": {
   "element": "pagination-element-3",
   "locator": {
    "id": "pagination-element-3"
   },
   "provenance": {
    "source": "observed",
    "env": "cnr2dev3",
    "date": "2026-09-25",
    "ref": "apps/snd/knowledge/screens_observed/DYL_202037.json"
   },
   "seen_in": [
    "observed:cnr2dev3:2026-09-25"
   ]
  },
  "4": {
   "element": "pagination-element-4",
   "locator": {
    "id": "pagination-element-4"
   },
   "provenance": {
    "source": "observed",
    "env": "cnr2dev3",
    "date": "2026-09-25",
    "ref": "apps/snd/knowledge/screens_observed/DYL_202037.json"
   },
   "seen_in": [
    "observed:cnr2dev3:2026-09-25"
   ]
  },
  "5": {
   "element": "pagination-element-5",
   "locator": {
    "id": "pagination-element-5"
   },
   "provenance": {
    "source": "observed",
    "env": "cnr2dev3",
    "date": "2026-09-25",
    "ref": "apps/snd/knowledge/screens_observed/DYL_202037.json"
   },
   "seen_in": [
    "observed:cnr2dev3:2026-09-25"
   ]
  },
  "38": {
   "element": "pagination-element-38",
   "locator": {
    "id": "pagination-element-38"
   },
   "provenance": {
    "source": "observed",
    "env": "cnr2dev3",
    "date": "2026-09-25",
    "ref": "apps/snd/knowledge/screens_observed/DYL_202037.json"
   },
   "seen_in": [
    "observed:cnr2dev3:2026-09-25"
   ]
  }
 },
 "grids": {
  "grid1": {
   "columns": [
    "Selling Category",
    "Section",
    "Outlet Name",
    "Sequence No",
    "Outlet Code"
   ],
   "edit_mode": "row",
   "selection": "single",
   "provenance": {
    "source": "observed",
    "env": "cnr2dev3",
    "date": "2026-09-25",
    "ref": "apps/snd/knowledge/screens_observed/DYL_202037.json"
   },
   "row_by_first_cell": "//tr[contains(@class,'dx-data-row')][td[normalize-space(.)='{value}']]/td[1]"
  },
  "PJP Daily Inquiry grid 2": {
   "columns": [
    "PJP Description",
    "DSR",
    "Warehouse",
    "Daily Route No",
    "Journey Status",
    "Journey Start Date",
    "Journey End Date",
    "DSR File Status"
   ],
   "provenance": {
    "source": "observed",
    "env": "cnr2dev3",
    "date": "2026-09-25",
    "ref": "apps/snd/knowledge/screens_observed/DYL_202037.json"
   },
   "row_by_first_cell": "//tr[contains(@class,'dx-data-row')][td[normalize-space(.)='{value}']]/td[1]"
  }
 },
 "messages": [],
 "lessons": [
  {
   "text": "The result of Process (daily route and outlets due that day) is visible only after a full page reload.",
   "kind": "screen",
   "field": null,
   "source": "knowledge/business/LIVE_FINDINGS.md (2026-10-13 session)",
   "date": "2026-10-13"
  }
 ],
 "differences": [],
 "business_page": "knowledge/business/master_data/pjp.md",
 "trained": {
  "status": true,
  "date": "2026-10-14",
  "how": [
   "business page",
   "group 66 walk"
  ]
 },
 "sources": {
  "db": "apps/snd/knowledge/screens_db/DYL_202037.json",
  "observed": [
   "apps/snd/knowledge/screens_observed/DYL_202037.json"
  ],
  "recorded": [],
  "stated": [
   "apps/snd/tools/screen_lessons_backfill.json"
  ]
 },
 "updated": "2026-10-14"
}
