{
 "$schema": "../../../plugins/qa-os/schemas/screen.schema.json",
 "option_id": "SALESRETURNVIEW",
 "title": "Sales Return View",
 "menu": {
  "path": [
   "Transaction",
   "Sales Return",
   "Sales Return View"
  ],
  "option_id": "SALESRETURNVIEW",
  "search_text": "Sales Return View",
  "top_id": "NG09",
  "app_option": null
 },
 "route": "/sales-return-statusChange/view",
 "page_param": null,
 "layout_code": null,
 "kind": "static",
 "tabs": [
  {
   "label": "Header",
   "element": null,
   "provenance": {
    "source": "observed",
    "env": "cnr1dev1",
    "date": "2026-10-01",
    "ref": "apps/snd/knowledge/screens_observed/LIVE_SALES_RETURN_VIEW.json"
   }
  },
  {
   "label": "Detail",
   "element": null,
   "provenance": {
    "source": "observed",
    "env": "cnr1dev1",
    "date": "2026-10-01",
    "ref": "apps/snd/knowledge/screens_observed/LIVE_SALES_RETURN_VIEW.json"
   }
  }
 ],
 "fields": {
  "PJP Number": {
   "element": "pjpNo",
   "widget": "select",
   "provenance": {
    "source": "observed",
    "env": "cnr1dev1",
    "date": "2026-10-01",
    "ref": "apps/snd/knowledge/screens_observed/LIVE_SALES_RETURN_VIEW.json"
   },
   "locator": {
    "id": "pjpNo"
   },
   "tab": "Header",
   "default": "AutoPJGIN2-Auto GIN PJP DM",
   "seen_in": [
    "observed:cnr1dev1:2026-10-01"
   ]
  },
  "Date From": {
   "element": "dateFrom",
   "widget": "date",
   "provenance": {
    "source": "observed",
    "env": "cnr1dev1",
    "date": "2026-10-01",
    "ref": "apps/snd/knowledge/screens_observed/LIVE_SALES_RETURN_VIEW.json"
   },
   "locator": {
    "id": "dateFrom"
   },
   "tab": "Header",
   "default": "today (2026-10-01)",
   "seen_in": [
    "observed:cnr1dev1:2026-10-01"
   ]
  },
  "Date To": {
   "element": "dateTo",
   "widget": "date",
   "provenance": {
    "source": "observed",
    "env": "cnr1dev1",
    "date": "2026-10-01",
    "ref": "apps/snd/knowledge/screens_observed/LIVE_SALES_RETURN_VIEW.json"
   },
   "locator": {
    "id": "dateTo"
   },
   "tab": "Header",
   "default": "today (2026-10-01)",
   "seen_in": [
    "observed:cnr1dev1:2026-10-01"
   ]
  }
 },
 "buttons": {
  "Forward": {
   "element": "Forward",
   "locator": {
    "id": "Forward"
   },
   "provenance": {
    "source": "observed",
    "env": "cnr1dev1",
    "date": "2026-10-01",
    "ref": "apps/snd/knowledge/screens_observed/LIVE_SALES_RETURN_VIEW.json"
   },
   "risk": "changes-data",
   "seen_in": [
    "observed:cnr1dev1:2026-10-01"
   ]
  }
 },
 "grids": {
  "Sales Return View": {
   "columns": [
    "Document No.",
    "Order Number",
    "Invoice Number",
    "Document Date",
    "Delivery Date",
    "Outlet Code",
    "Gross Amount",
    "Markup",
    "Discount Amount",
    "Tax",
    "Net Amount",
    "Principle Invoice"
   ],
   "provenance": {
    "source": "observed",
    "env": "cnr1dev1",
    "date": "2026-10-01",
    "ref": "apps/snd/knowledge/screens_observed/LIVE_SALES_RETURN_VIEW.json"
   },
   "row_by_first_cell": "//tr[contains(@class,'dx-data-row')][td[normalize-space(.)='{value}']]/td[1]"
  }
 },
 "messages": [],
 "lessons": [],
 "differences": [],
 "business_page": "knowledge/business/delivery_and_returns/sales_return.md",
 "business_pages_also": [
  "knowledge/business/delivery_and_returns/delivery_lifecycle.md"
 ],
 "trained": {
  "status": true,
  "date": "2026-10-08",
  "how": [
   "business page",
   "group 11 walk",
   "live read-only look"
  ]
 },
 "sources": {
  "db": null,
  "observed": [
   "apps/snd/knowledge/screens_observed/LIVE_SALES_RETURN_VIEW.json",
   "apps/snd/knowledge/screens_observed/SALESRETURNVIEW.json"
  ],
  "recorded": [],
  "stated": []
 },
 "updated": "2026-10-08"
}
