{
 "$schema": "../../../plugins/qa-os/schemas/screen.schema.json",
 "option_id": "CHANGETRACK_OUTL_DOC",
 "title": "Change Track Outlet Document",
 "menu": {
  "path": [
   "Distributor Setup",
   "Outlet Profile",
   "Change Track Outlet Document"
  ],
  "option_id": "CHANGETRACK_OUTL_DOC",
  "search_text": "Change Track Outlet Document",
  "top_id": "NG04",
  "app_option": null
 },
 "route": "/change-management/outlet-document",
 "page_param": "pageCodeGrid=102003041&fieldComb=pbet_busentity_type&valueComb=OUTL&serialNoGrid=1&pageCodeForm=102003048&serialNoForm=1&label1=Outlet Modification Request List&label2=List of Outlets&label3=Outlet Modification attribute\n",
 "layout_code": null,
 "kind": "static",
 "tabs": [],
 "fields": {},
 "buttons": {
  "1": {
   "element": "pagination-element-1",
   "locator": {
    "id": "pagination-element-1"
   },
   "provenance": {
    "source": "observed",
    "env": "cnr2dev3",
    "date": "2026-09-25",
    "ref": "apps/snd/knowledge/screens_observed/CHANGETRACK_OUTL_DOC.json"
   },
   "seen_in": [
    "observed:cnr2dev3:2026-09-25"
   ]
  },
  "2": {
   "element": "pagination-element-2",
   "locator": {
    "id": "pagination-element-2"
   },
   "provenance": {
    "source": "observed",
    "env": "cnr2dev3",
    "date": "2026-09-25",
    "ref": "apps/snd/knowledge/screens_observed/CHANGETRACK_OUTL_DOC.json"
   },
   "seen_in": [
    "observed:cnr2dev3:2026-09-25"
   ]
  },
  "3": {
   "element": "pagination-element-3",
   "locator": {
    "id": "pagination-element-3"
   },
   "provenance": {
    "source": "observed",
    "env": "cnr2dev3",
    "date": "2026-09-25",
    "ref": "apps/snd/knowledge/screens_observed/CHANGETRACK_OUTL_DOC.json"
   },
   "seen_in": [
    "observed:cnr2dev3:2026-09-25"
   ]
  },
  "4": {
   "element": "pagination-element-4",
   "locator": {
    "id": "pagination-element-4"
   },
   "provenance": {
    "source": "observed",
    "env": "cnr2dev3",
    "date": "2026-09-25",
    "ref": "apps/snd/knowledge/screens_observed/CHANGETRACK_OUTL_DOC.json"
   },
   "seen_in": [
    "observed:cnr2dev3:2026-09-25"
   ]
  },
  "5": {
   "element": "pagination-element-5",
   "locator": {
    "id": "pagination-element-5"
   },
   "provenance": {
    "source": "observed",
    "env": "cnr2dev3",
    "date": "2026-09-25",
    "ref": "apps/snd/knowledge/screens_observed/CHANGETRACK_OUTL_DOC.json"
   },
   "seen_in": [
    "observed:cnr2dev3:2026-09-25"
   ]
  },
  "1946": {
   "element": "pagination-element-1946",
   "locator": {
    "id": "pagination-element-1946"
   },
   "provenance": {
    "source": "observed",
    "env": "cnr2dev3",
    "date": "2026-09-25",
    "ref": "apps/snd/knowledge/screens_observed/CHANGETRACK_OUTL_DOC.json"
   },
   "seen_in": [
    "observed:cnr2dev3:2026-09-25"
   ]
  }
 },
 "grids": {
  "Change Track Outlet Document": {
   "columns": [
    "Request No",
    "Description",
    "Distributor",
    "Status",
    "Request Date",
    "Outlet Code"
   ],
   "provenance": {
    "source": "observed",
    "env": "cnr2dev3",
    "date": "2026-09-25",
    "ref": "apps/snd/knowledge/screens_observed/CHANGETRACK_OUTL_DOC.json"
   },
   "row_by_first_cell": "//tr[contains(@class,'dx-data-row')][td[normalize-space(.)='{value}']]/td[1]"
  }
 },
 "messages": [],
 "lessons": [],
 "differences": [],
 "business_page": "knowledge/business/master_data/outlet.md",
 "trained": {
  "status": true,
  "date": "2026-10-14",
  "how": [
   "business page",
   "group 66 walk"
  ]
 },
 "sources": {
  "db": null,
  "observed": [
   "apps/snd/knowledge/screens_observed/CHANGETRACK_OUTL_DOC.json"
  ],
  "recorded": [],
  "stated": []
 },
 "updated": "2026-10-14"
}
