{
 "$schema": "../../../plugins/qa-os/schemas/screen.schema.json",
 "option_id": "CLAIM_PERIOD",
 "title": "Distributor Claim Period",
 "menu": {
  "path": [
   "Transaction",
   "Claim",
   "Distributor Claim Period"
  ],
  "option_id": "CLAIM_PERIOD",
  "search_text": "Distributor Claim Period",
  "top_id": "NG09",
  "app_option": null
 },
 "route": "/content-master/claim",
 "page_param": null,
 "layout_code": null,
 "kind": "static",
 "tabs": [],
 "fields": {
  "Claim Type": {
   "element": "documentType",
   "widget": "select",
   "provenance": {
    "source": "observed",
    "env": "cnr2dev3",
    "date": "2026-09-25",
    "ref": "apps/snd/knowledge/screens_observed/CLAIM_PERIOD.json"
   },
   "locator": {
    "id": "documentType"
   },
   "seen_in": [
    "observed:cnr2dev3:2026-09-25"
   ]
  },
  "Start Date": {
   "element": "startDate",
   "widget": "date",
   "provenance": {
    "source": "observed",
    "env": "cnr2dev3",
    "date": "2026-09-25",
    "ref": "apps/snd/knowledge/screens_observed/CLAIM_PERIOD.json"
   },
   "locator": {
    "id": "startDate"
   },
   "seen_in": [
    "observed:cnr2dev3:2026-09-25"
   ]
  },
  "End Date": {
   "element": "endDate",
   "widget": "date",
   "provenance": {
    "source": "observed",
    "env": "cnr2dev3",
    "date": "2026-09-25",
    "ref": "apps/snd/knowledge/screens_observed/CLAIM_PERIOD.json"
   },
   "locator": {
    "id": "endDate"
   },
   "seen_in": [
    "observed:cnr2dev3:2026-09-25"
   ]
  },
  "Claim Executed": {
   "element": "isClaimExecuted",
   "widget": "select",
   "provenance": {
    "source": "observed",
    "env": "cnr2dev3",
    "date": "2026-09-25",
    "ref": "apps/snd/knowledge/screens_observed/CLAIM_PERIOD.json"
   },
   "locator": {
    "id": "isClaimExecuted"
   },
   "seen_in": [
    "observed:cnr2dev3:2026-09-25"
   ]
  }
 },
 "buttons": {
  "Add": {
   "element": "add",
   "locator": {
    "id": "add"
   },
   "provenance": {
    "source": "observed",
    "env": "cnr2dev3",
    "date": "2026-09-25",
    "ref": "apps/snd/knowledge/screens_observed/CLAIM_PERIOD.json"
   },
   "seen_in": [
    "observed:cnr2dev3:2026-09-25"
   ]
  },
  "Save": {
   "element": "save",
   "locator": {
    "id": "save"
   },
   "provenance": {
    "source": "observed",
    "env": "cnr2dev3",
    "date": "2026-09-25",
    "ref": "apps/snd/knowledge/screens_observed/CLAIM_PERIOD.json"
   },
   "seen_in": [
    "observed:cnr2dev3:2026-09-25"
   ]
  },
  "Update": {
   "element": "update",
   "locator": {
    "id": "update"
   },
   "provenance": {
    "source": "observed",
    "env": "cnr2dev3",
    "date": "2026-09-25",
    "ref": "apps/snd/knowledge/screens_observed/CLAIM_PERIOD.json"
   },
   "seen_in": [
    "observed:cnr2dev3:2026-09-25"
   ],
   "alt_elements": [
    "updateBtn"
   ],
   "note": "#update is the wrapper; the clickable inner element is #updateBtn"
  },
  "Delete": {
   "element": "delete",
   "locator": {
    "id": "delete"
   },
   "provenance": {
    "source": "observed",
    "env": "cnr2dev3",
    "date": "2026-09-25",
    "ref": "apps/snd/knowledge/screens_observed/CLAIM_PERIOD.json"
   },
   "seen_in": [
    "observed:cnr2dev3:2026-09-25"
   ]
  },
  "Translation": {
   "element": "crossBtn",
   "locator": {
    "id": "crossBtn"
   },
   "provenance": {
    "source": "observed",
    "env": "cnr2dev3",
    "date": "2026-09-25",
    "ref": "apps/snd/knowledge/screens_observed/CLAIM_PERIOD.json"
   },
   "seen_in": [
    "observed:cnr2dev3:2026-09-25"
   ]
  }
 },
 "grids": {
  "Claim Period Setup": {
   "columns": [
    "Distributor",
    "Claim Type",
    "Start Date",
    "End Date",
    "Is Claim Executed"
   ],
   "provenance": {
    "source": "observed",
    "env": "cnr2dev3",
    "date": "2026-09-25",
    "ref": "apps/snd/knowledge/screens_observed/CLAIM_PERIOD.json"
   },
   "row_by_first_cell": "//tr[contains(@class,'dx-data-row')][td[normalize-space(.)='{value}']]/td[1]"
  }
 },
 "messages": [],
 "lessons": [],
 "differences": [
  {
   "what": "menu title",
   "config": "Claim Period Setup",
   "live": "Distributor Claim Period",
   "env": null,
   "date": null,
   "ref": "knowledge/env/*/menu.*.json",
   "status": "open"
  }
 ],
 "business_page": "knowledge/business/promotions_and_budget/claims.md",
 "trained": {
  "status": true,
  "date": "2026-10-09",
  "how": [
   "business page"
  ]
 },
 "sources": {
  "db": null,
  "observed": [
   "apps/snd/knowledge/screens_observed/CLAIM_PERIOD.json"
  ],
  "recorded": [],
  "stated": []
 },
 "updated": "2026-10-09"
}
